{
  "schema_version": "1-candidate",
  "record_type": "journal",
  "id": "journal-demo",
  "revision": 1,
  "project_id": "project-demo",
  "created_at": "2026-10-06T12:00:00Z",
  "producer": {
    "id": "example-studio",
    "role": "studio"
  },
  "authority": "attributed_report",
  "access_scope": "selected_task",
  "supersedes": null,
  "payload": {
    "task": {
      "id": "task-demo",
      "revision": 1
    },
    "intent": "Demonstrate continuity",
    "approach": "configure",
    "evidence": [
      {
        "id": "verification-demo",
        "revision": 1
      },
      {
        "id": "review_decision-demo",
        "revision": 1
      }
    ],
    "observed_outcome": "Synthetic example only",
    "next_action": "Discover actual host seam before implementation"
  }
}
