{
  "schema_version": "1-candidate",
  "record_type": "contribution",
  "id": "contribution-demo",
  "revision": 1,
  "project_id": "project-demo",
  "created_at": "2026-10-06T12:00:00Z",
  "producer": {
    "id": "example-worker",
    "role": "worker"
  },
  "authority": "attributed_report",
  "access_scope": "selected_task",
  "supersedes": null,
  "payload": {
    "run": {
      "id": "run-demo",
      "revision": 1
    },
    "repository_id": "example-worker",
    "base_commit": "aaaaaaaaaaaaaaaaaaaaaaaaaaaaaaaaaaaaaaaa",
    "head_commit": "bbbbbbbbbbbbbbbbbbbbbbbbbbbbbbbbbbbbbbbb",
    "changed_paths": [
      "shell/navigation.json"
    ],
    "diff_sha256": "ffffffffffffffffffffffffffffffffffffffffffffffffffffffffffffffff",
    "reported_tests": {
      "passed": true,
      "independent": false
    },
    "summary": "Synthetic worker report; not trusted verification"
  }
}
