{
  "schema_version": "1-candidate",
  "record_type": "verification",
  "id": "verification-demo",
  "revision": 1,
  "project_id": "project-demo",
  "created_at": "2026-10-06T12:00:00Z",
  "producer": {
    "id": "example-verifier",
    "role": "verifier"
  },
  "authority": "trusted_verification",
  "access_scope": "selected_task",
  "supersedes": null,
  "payload": {
    "candidate": {
      "id": "candidate-demo",
      "revision": 1
    },
    "candidate_commit": "cccccccccccccccccccccccccccccccccccccccc",
    "result": "passed",
    "checks": [
      {
        "criterion": {
          "id": "criterion-demo",
          "revision": 1
        },
        "result": "passed",
        "command": "example-navigation-check (synthetic)",
        "exit_code": 0
      }
    ],
    "environment_fingerprint": "synthetic-independent-verifier",
    "started_at": "2026-10-06T12:00:00Z",
    "finished_at": "2026-10-06T12:00:00Z"
  }
}
