{
  "schema_version": "1-candidate",
  "record_type": "review_decision",
  "id": "review_decision-demo",
  "revision": 1,
  "project_id": "project-demo",
  "created_at": "2026-10-06T12:00:00Z",
  "producer": {
    "id": "example-operator",
    "role": "operator"
  },
  "authority": "operator_decision",
  "access_scope": "selected_task",
  "supersedes": null,
  "payload": {
    "task": {
      "id": "task-demo",
      "revision": 1
    },
    "candidate": {
      "id": "candidate-demo",
      "revision": 1
    },
    "candidate_commit": "cccccccccccccccccccccccccccccccccccccccc",
    "verifications": [
      {
        "id": "verification-demo",
        "revision": 1
      }
    ],
    "disposition": "accepted",
    "rationale": "Synthetic decision for validation; no real operator acceptance"
  }
}
