{
  "schema_version": "1-candidate",
  "record_type": "task",
  "id": "task-demo",
  "revision": 1,
  "project_id": "project-demo",
  "created_at": "2026-10-06T12:00:00Z",
  "producer": {
    "id": "example-operator",
    "role": "operator"
  },
  "authority": "operator_intent",
  "access_scope": "selected_task",
  "supersedes": null,
  "payload": {
    "milestone": {
      "id": "milestone-demo",
      "revision": 1
    },
    "title": "Synthetic navigation entry",
    "goal": "Demonstrate record relationships only",
    "base_commit": "aaaaaaaaaaaaaaaaaaaaaaaaaaaaaaaaaaaaaaaa",
    "allowed_paths": [
      "shell/navigation.json"
    ],
    "criteria": [
      {
        "id": "criterion-demo",
        "revision": 1
      }
    ],
    "assignments": [
      {
        "id": "assignment-demo",
        "revision": 1
      }
    ],
    "status": "review"
  }
}
