{
  "schema_version": "1-candidate",
  "record_type": "candidate",
  "id": "candidate-demo",
  "revision": 1,
  "project_id": "project-demo",
  "created_at": "2026-10-06T12:00:00Z",
  "producer": {
    "id": "example-studio",
    "role": "studio"
  },
  "authority": "attributed_report",
  "access_scope": "selected_task",
  "supersedes": null,
  "payload": {
    "task": {
      "id": "task-demo",
      "revision": 1
    },
    "manifest": {
      "id": "context_manifest-demo",
      "revision": 1
    },
    "contributions": [
      {
        "id": "contribution-demo",
        "revision": 1
      }
    ],
    "repository_id": "example-candidate",
    "base_commit": "aaaaaaaaaaaaaaaaaaaaaaaaaaaaaaaaaaaaaaaa",
    "commit": "cccccccccccccccccccccccccccccccccccccccc",
    "status": "constructed"
  }
}
