{
  "schema_version": "1-candidate",
  "record_type": "deployment_receipt",
  "id": "deployment_receipt-demo",
  "revision": 1,
  "project_id": "project-demo",
  "created_at": "2026-10-06T12:00:00Z",
  "producer": {
    "id": "example-delivery",
    "role": "delivery"
  },
  "authority": "trusted_delivery",
  "access_scope": "selected_task",
  "supersedes": null,
  "payload": {
    "integration": {
      "id": "integration_receipt-demo",
      "revision": 1
    },
    "source_commit": "cccccccccccccccccccccccccccccccccccccccc",
    "target": "example-preview-not-deployed",
    "status": "confirmed",
    "idempotency_key": "synthetic-deploy-1"
  }
}
